start	end	text
91	178	Last month was the hottest June ever recorded, the EU‘s satellite agency has announced.
432	652	The data showed European average ​temperatures were more than 2C above normal and temperatures were 6-10C above normal over most of France, Germany and northern Spain during the final days of the month, according to C3S.
1043	1285	Rapid assessment of average temperatures in France between 26-28 June showed a “substantial” increase in the likelihood of the heatwave happening as a result of human-caused global warming, experts at the World Weather Attribution group said.
2286	2569	Spikes in European average temperatures of more than 1C above normal have occurred before, such as in 1917 and 1999, but C3S said the recent heatwave was notable because the sudden increase came on top of a general rise of around 1.5C in European temperature over the past 100 years.
2983	3095	“Heatwaves occur in any climate, but we know that heatwaves are becoming much more likely due to climate change.
